raw_aspect,sentence,label,label_id
price,valuable phone in this price,price,74
camera quality,"camera quality is good, smooth to use",camera,17
smooth to use,"camera quality is good, smooth to use",usability,103
super camera,"super camera, good battery backup in this price",camera,17
good battery backup in this price,"super camera, good battery backup in this price",battery_life,7
it,"not bet, it is good",overall,65
camera,very good camera,camera,17
phone,this phone is approximately best for middle class people,overall,65
mara value for money,mara value for money,value_for_money,104
nice looking honer 10 lite,nice looking honer 10 lite,design,34
camera,camera is good,camera,17
phone,it's really osm phone camera is to good,overall,65
camera,it's really osm phone camera is to good,camera,17
camera,i liked the camera most,camera,17
mobile screen,my mobile screen got damaged on 3 sept 19 and till now they are saying that our backup team will call you with in 24 hrs but its more than 1 month but i did not get any call or msg,display,37
value of money,value of money 👍👍👍👍👍👍👍👍,value_for_money,104
touch screen,touch screen very sensitive,touchscreen,101
inside parts,"it is just looking like new mobiles but inside parts are used and damaged, this is i personally experienced",internal_components,53
phone,just awesome phone,overall,65
playing pubg,best for playing pubg,gaming_performance,47
camera,camera is better,camera,17
betry pikap,nice luck slim fiss betry pikap not done but very nice fone,battery,6
fone,nice luck slim fiss betry pikap not done but very nice fone,phone_type,71
smartphone,best smartphone at this price,phone_type,71
camera,"nyc camera , display and design",camera,17
display,"nyc camera , display and design",display,37
design,"nyc camera , display and design",design,34
price range,best in market at this price range,price,74
phone camera,this phone camera is good,camera,17
value for money,value for money nice phone nice camera performance 👍👍,value_for_money,104
nice phone,value for money nice phone nice camera performance 👍👍,overall,65
nice camera performance,value for money nice phone nice camera performance 👍👍,camera,17
camera vewing angle,its aswm camera vewing angle,camera,17
performace,and performace was too good,performance,68
design,pros -excellent designdual volte supportgaming performancebattery backupcamera performancecons -hybrid sim slotno fast chargingno hd streaming,design,34
dual volte support,pros -excellent designdual volte supportgaming performancebattery backupcamera performancecons -hybrid sim slotno fast chargingno hd streaming,features,44
gaming performance,pros -excellent designdual volte supportgaming performancebattery backupcamera performancecons -hybrid sim slotno fast chargingno hd streaming,gaming_performance,47
battery backup,pros -excellent designdual volte supportgaming performancebattery backupcamera performancecons -hybrid sim slotno fast chargingno hd streaming,battery_life,7
camera performance,pros -excellent designdual volte supportgaming performancebattery backupcamera performancecons -hybrid sim slotno fast chargingno hd streaming,camera_performance,19
hybrid sim slot,pros -excellent designdual volte supportgaming performancebattery backupcamera performancecons -hybrid sim slotno fast chargingno hd streaming,sim_card_slot,87
fast charging,pros -excellent designdual volte supportgaming performancebattery backupcamera performancecons -hybrid sim slotno fast chargingno hd streaming,charging_speed,24
hd streaming,pros -excellent designdual volte supportgaming performancebattery backupcamera performancecons -hybrid sim slotno fast chargingno hd streaming,streaming,99
phone,one of the best phone in offer zone,overall,65
budget mobile,best budget mobile,value_for_money,104
satisfied,good i totally satisfied,overall,65
phone,nice phone nd suppeerrbb camera,overall,65
camera,nice phone nd suppeerrbb camera,camera,17
camera,it's amazing superb camera an fabulous look n performance,camera,17
look,it's amazing superb camera an fabulous look n performance,design,34
performance,it's amazing superb camera an fabulous look n performance,performance,68
device,good device in this range with decent performance,overall,65
performance,good device in this range with decent performance,performance,68
sound quality,sound quality very bad,sound_quality,93
tempered glass,tempered glass is little warm,display_protection,38
camera,camera is not satisfying,camera,17
very good mobile,very good mobile but i will buy the 3gb ram mobile storage quickly full,overall,65
3gb ram mobile storage,very good mobile but i will buy the 3gb ram mobile storage quickly full,storage,98
phone,is good phone,overall,65
phn look,awsome phn look so nice,design,34
performance,mobile are good performance,performance,68
camera,best phone in this price camera is best i used 3gb variate but no lag problem in pub g & high graphics games thanks honor india,camera,17
no lag problem in pub g & high graphics games,best phone in this price camera is best i used 3gb variate but no lag problem in pub g & high graphics games thanks honor india,gaming_performance,47
company,"nice, nice company for honar mobile is good",brand,10
easy to handle,"very nice, easy to handle and good to play pubg without lag",ergonomics,42
play pubg without lag,"very nice, easy to handle and good to play pubg without lag",gaming_performance,47
look,look wise gud,design,34
camera quality,gud camera quality,camera,17
phone,best phone in this prize,overall,65
prize,best phone in this prize,price,74
quality,very good quality,quality,81
camera clarity,camera clarity is good 👍,camera,17
product,very good product,overall,65
heating problem,my mobile is very heating problem,heat,52
drin battery,flipkart products rrferble pic not sele in new product or very drin battery not purchase this item,battery,6
product,good product and superb performance,overall,65
performance,good product and superb performance,performance,68
phone,best phone but battery backup very low,overall,65
battery backup,best phone but battery backup very low,battery_life,7
cemra 24 mp,nice product very good cemra 24 mp,camera,17
honor,honor is the best brand,brand,10
everything,"everything is good on this mobile, but its signal strength are its ok , not good not bad",overall,65
signal strength,"everything is good on this mobile, but its signal strength are its ok , not good not bad",signal_strength,86
3gb 32gb,my honor 10 lite 3gb 32gb very hanging,storage,98
hanging,my honor 10 lite 3gb 32gb very hanging,performance,68
photo,this photo is shot from honor 10 lite,camera,17
camera,the camera is amazing,camera,17
ai option,i took this picture with ai option turned on,camera_settings,21
ai function,while i was taking the pic its ai function recognised it as sunset photo capturing,ai_features,1
sunset photo capturing,while i was taking the pic its ai function recognised it as sunset photo capturing,ai_features,1
phone,one of the ghatiya phone i have used,overall,65
mobile,good mobile but battery backup is a little weak,overall,65
battery backup,good mobile but battery backup is a little weak,battery_life,7
phone,"super phone ,slim phone and good luck but battery medium no high level",overall,65
slim phone,"super phone ,slim phone and good luck but battery medium no high level",slimness,88
battery,"super phone ,slim phone and good luck but battery medium no high level",battery,6
phone,"a decent phone,decent pricing❤️",overall,65
pricing,"a decent phone,decent pricing❤️",price,74
camera,everything is best camera 👌 light weight best selfie camera,camera,17
light weight,everything is best camera 👌 light weight best selfie camera,weight,108
selfie camera,everything is best camera 👌 light weight best selfie camera,camera,17
battery backup,battery backup is not good as compared to money,battery_life,7
money,battery backup is not good as compared to money,value_for_money,104
every penny is worthy,every penny is worthy,value_for_money,104
honor phones,super honor phones,brand,10
antutu benchmark,tested antutu benchmark and got score of 155000👌👌 totally unexpected from 3gb ram variant,performance,68
score of 155000,tested antutu benchmark and got score of 155000👌👌 totally unexpected from 3gb ram variant,benchmark_score,8
3gb ram variant,tested antutu benchmark and got score of 155000👌👌 totally unexpected from 3gb ram variant,ram,82
heating issue,no heating issue,heat,52
mobile,osm mobile in this range,phone_type,71
camera,superb mobile camera is good nice looking and good performance but very very worst delivery,camera,17
nice looking,superb mobile camera is good nice looking and good performance but very very worst delivery,design,34
good performance,superb mobile camera is good nice looking and good performance but very very worst delivery,performance,68
budget product,nice budget product,overall_value,66
mobile camera,mobile camera and mobile display is very nice mobile looking is very nice but this phone battery is not so good,camera,17
mobile display,mobile camera and mobile display is very nice mobile looking is very nice but this phone battery is not so good,display,37
mobile looking,mobile camera and mobile display is very nice mobile looking is very nice but this phone battery is not so good,design,34
phone battery,mobile camera and mobile display is very nice mobile looking is very nice but this phone battery is not so good,battery,6
camera,camera and performance is superb,camera,17
performance,camera and performance is superb,performance,68
light weight,"light weight,slim body,thin bezzle,well display,but camera is avg",weight,108
slim body,"light weight,slim body,thin bezzle,well display,but camera is avg",slimness,88
thin bezzle,"light weight,slim body,thin bezzle,well display,but camera is avg",design,34
well display,"light weight,slim body,thin bezzle,well display,but camera is avg",display,37
camera,"light weight,slim body,thin bezzle,well display,but camera is avg",camera,17
budget phone,good budget phone,value_for_money,104
phone,perfect phone in this price segment,overall,65
price segment,perfect phone in this price segment,price,74
overall,overall its a perfect package,overall,65
phone,the phone is awesome to use,overall,65
value for money,great value for money,value_for_money,104
full hd display,purchased the phone for 7999/- and since it's a full hd display,display,37
price,i give it a thumbs up for the price it's being sold,price,74
camera quality,camera quality good performance awesome,camera,17
performance,camera quality good performance awesome,performance,68
phone for pubg,one of the bast phone for pubg,gaming_performance,47
camera,best phone in terms of camera and battery performance is also good the only thing it has a hybrid slot but it's okay,camera,17
battery performance,best phone in terms of camera and battery performance is also good the only thing it has a hybrid slot but it's okay,battery,6
hybrid slot,best phone in terms of camera and battery performance is also good the only thing it has a hybrid slot but it's okay,sim_card_slot,87
good looking,good looking and good picture quality,design,34
good picture quality,good looking and good picture quality,camera,17
mobile,the mobile is very good,phone_type,71
notification light,it has a notification light which other notch mobiles don't usually have,notification_light,62
processor,"moreover, it's processor is quite good",performance,68
overall,overall a good mobile,overall,65
camera phone,it's a good camera phone,camera,17
looks,good looks &premium in hand,design,34
premium in hand,good looks &premium in hand,build_quality,14
phone,i'm fully seitysfy this phone,overall,65
display,display it so good,display,37
cemara,cemara is a suppar collity,product_quality,78
suppar collity,cemara is a suppar collity,quality,81
pubg,and pubg so much better no any problems,gaming_performance,47
display,"giv me a 5to5 stars for display, 5 to 5 star to cemera",display,37
cemera,"giv me a 5to5 stars for display, 5 to 5 star to cemera",camera,17
battery,5 to 3_4 star battery,battery,6
mobile,super mobile must buy,overall,65
products,products is good,overall,65
9k price rang,9k price rang is good,price,74
phone,its good phone,overall,65
product,"very good product, value for money",value_for_money,104
value for money,"very good product, value for money",value_for_money,104
selfie camera quality,good selfie camera quality and stylish look,camera,17
stylish look,good selfie camera quality and stylish look,design,34
product,it's nice product like it,overall,65
quality display,quality display and shining body,display,37
shining body,quality display and shining body,design,34
battery backup,battery backup only average,battery_life,7
camera performance,camera performance not bad,camera_performance,19
value for money,totally value for money,value_for_money,104
working,working superfine but ram management is worst,performance,68
ram management,working superfine but ram management is worst,ram,82
ram management,one of the worst ram management i have ever faced on any mobile,performance,68
kills the apps,kills the apps within seconds,app_management,3
rest all,rest all are excellent,overall,65
photos,good quality photos,camera,17
selfie,mind blowing selfie,camera,17
phone,best phone in this range,overall,65
work,very good work,overall,65
luks,luks r just premium nd amazing,appearance,5
new emui,the new emui is working like,ui,102
butter nd kirin 710 processor,butter nd kirin 710 processor is providing more than enough power__ this phone is reallly killer,performance,68
power,butter nd kirin 710 processor is providing more than enough power__ this phone is reallly killer,performance,68
this phone,butter nd kirin 710 processor is providing more than enough power__ this phone is reallly killer,overall,65
silicon back covers quality,everything is very good but one thing that disappoints the silicon back covers quality is not good its looking like used product woth many scratches,build_quality,14
scratches,everything is very good but one thing that disappoints the silicon back covers quality is not good its looking like used product woth many scratches,build_quality,14
phone,but only because of the phone i gave 5 star rating,overall,65
battery,battery not good,battery,6
product,not a great product for this budget,overall,65
slow process,"slow process ,file moving and copying is dead slow",performance,68
file moving and copying,"slow process ,file moving and copying is dead slow",performance,68
camera,"camera is outstanding, battery backup is good but ultra power saving mode is excellent features provided by honor",camera,17
battery backup,"camera is outstanding, battery backup is good but ultra power saving mode is excellent features provided by honor",battery_life,7
ultra power saving mode,"camera is outstanding, battery backup is good but ultra power saving mode is excellent features provided by honor",features,44
good finsihed mobile,good finsihed mobile value for money,build_quality,14
value for money,good finsihed mobile value for money,value_for_money,104
in every aspect,"i have mi note 7 also, in front of it, it is low in every aspect",overall,65
u r honour lovers,better option if u r honour lovers,brand,10
sim tray,"i thought the sim tray was defected, because it was very hard to take out, may be because of new paint and all",sim_card_slot,87
mobile,"super mobile,worth of money",overall,65
worth of money,"super mobile,worth of money",value_for_money,104
phn,owesome phn in this price i lubed it,phone_type,71
screen,screen damage in one drop,display,37
phone,best phone but price is too high,price,74
price,best phone but price is too high,price,74
front cam,front cam 10/6back cam,camera,17
back cam,front cam 10/6back cam,camera,17
battery,10/7battery 10/7processer 10/10look 10/10for pub g,battery,6
processer,10/7battery 10/7processer 10/10look 10/10for pub g,performance,68
look,10/7battery 10/7processer 10/10look 10/10for pub g,design,34
pub g,10/7battery 10/7processer 10/10look 10/10for pub g,gaming_performance,47
finger lock,10/10finger lock 10/10face lock 10/10,fingerprint_sensor,45
face lock,10/10finger lock 10/10face lock 10/10,face_unlock,43
phone,"best premium phone compare to mi, asus, realme",phone_type,71
phone,nice phone values of money,overall,65
values of money,nice phone values of money,value_for_money,104
this smartphone,need improvement for this smartphone,overall,65
price segment,best in this price segment,price,74
it,in this range it's the best,overall,65
camera quality,camera quality and screen is 👌👌👌👌👌***** for everyone,camera,17
screen,camera quality and screen is 👌👌👌👌👌***** for everyone,display,37
battery backup,battery backup bad and charger very heated,battery,6
charger,battery backup bad and charger very heated,heat,52
product,amazing product in this price segment,overall,65
price segment,amazing product in this price segment,value_for_money,104
mobile,nice mobile honor 10 lite for price 10000,product_name,77
price,nice mobile honor 10 lite for price 10000,price,74
mobile,very nice mobile,overall,65
camera,"hmm,,,,superb camera ,,best display,,kirin 710 ,,in this price range ,,,best phone,,,😁😁😁",camera,17
display,"hmm,,,,superb camera ,,best display,,kirin 710 ,,in this price range ,,,best phone,,,😁😁😁",display,37
kirin 710,"hmm,,,,superb camera ,,best display,,kirin 710 ,,in this price range ,,,best phone,,,😁😁😁",internal_components,53
price range,"hmm,,,,superb camera ,,best display,,kirin 710 ,,in this price range ,,,best phone,,,😁😁😁",price,74
phone,"hmm,,,,superb camera ,,best display,,kirin 710 ,,in this price range ,,,best phone,,,😁😁😁",overall,65
phone,nice phone osm feeling,overall,65
feeling,nice phone osm feeling,material_feel,57
picture quality,awesome picture quality,camera,17
phone,very nice phone honour 10 lite,phone_type,71
cheapest price,in cheapest price you will get all features which are available in many high ranges phone,price,74
all features which are available in many high ranges phone,in cheapest price you will get all features which are available in many high ranges phone,features,44
battery back up,only battery back up slight low,battery_life,7
all,all is well,overall,65
value for money,mobile value for money and the fire,value_for_money,104
good looking,good looking nice performance,design,34
nice performance,good looking nice performance,performance,68
price,best at this price,price,74
value product,not a value product,value_for_money,104
product,superb product 😘😘,overall,65
overheating,phone is overheating and very bad performance,heat,52
very bad performance,phone is overheating and very bad performance,performance,68
low light camera,"low light camera is not good, touch response and performance are also not good, got hanged on very first day",camera,17
touch response,"low light camera is not good, touch response and performance are also not good, got hanged on very first day",touchscreen,101
performance,"low light camera is not good, touch response and performance are also not good, got hanged on very first day",performance,68
got hanged,"low light camera is not good, touch response and performance are also not good, got hanged on very first day",crashing,32
battery,battery is very bad,battery,6
honor product,it doesn't look like an honor product,brand,10
heating problem,too much heating problem,heat,52
money,waste of money,value_for_money,104
quality features,best quality features,features,44
overheating,the worst thing is overheating in little bit use,performance,68
📷,📷 is disgusting 24 mp =2mp i suggest not to buy this product,camera,17
24 mp,📷 is disgusting 24 mp =2mp i suggest not to buy this product,camera,17
2mp,📷 is disgusting 24 mp =2mp i suggest not to buy this product,camera,17
product,good product i like,overall,65
experience,it was a great experience,overall,65
performance,i get this phone for 8000rs that's why it is very very good smartphone for me and its performance and camera qualiti also good,performance,68
camera qualiti,i get this phone for 8000rs that's why it is very very good smartphone for me and its performance and camera qualiti also good,camera,17
it,i get this phone for 8000rs that's why it is very very good smartphone for me and its performance and camera qualiti also good,overall,65
display,display gets damaged just after warranty completion,display,37
side frames,"1 year 1 month, side frames getting bulger and customer care doesn't respond properly",build_quality,14
honor products,don't go for honor products,brand,10
display,display & camera is awesome,display,37
camera,display & camera is awesome,camera,17
performance,performance little bit slower,performance,68
sagement,best in the sagement,segment,84
product,very good product in this price,overall,65
price,very good product in this price,price,74
price,the price of the mobile is good,price,74
product,this is very usedfull product,overall,65
game paly,smooth game paly battry backup ok,gaming_performance,47
battry backup,smooth game paly battry backup ok,battery_life,7
camera,might have some camera issue,camera,17
brand value,but this phone indicate the brand value of huwaai,brand,10
flagship features,"though it don't have much flagship features but it don't give you any kind of issue in optimisation, battery quality,no hanging",features,44
optimisation,"though it don't have much flagship features but it don't give you any kind of issue in optimisation, battery quality,no hanging",device_optimization,35
battery quality,"though it don't have much flagship features but it don't give you any kind of issue in optimisation, battery quality,no hanging",battery,6
hanging,"though it don't have much flagship features but it don't give you any kind of issue in optimisation, battery quality,no hanging",crashing,32
issues,"which is a mejor issues in recent realmi,redmi,smrtphones after 1year use",issues,54
long lasted mobile,so if u want long lasted mobile then go blindly for honor😘😘,battery_life,7
value for every penny,value for every penny,value_for_money,104
it,"after 14 months, it automatically stopped working",overall,65
mobile,👌👌👌👌 super mobile,overall,65
phone,one of the worst phone from honor,overall,65
phone,these phone has nothing,phone_type,71
camera,"not have better camera, processor, features,sound quality",camera,17
processor,"not have better camera, processor, features,sound quality",performance,68
features,"not have better camera, processor, features,sound quality",features,44
sound quality,"not have better camera, processor, features,sound quality",sound_quality,93
money,ruined my money,value_for_money,104
build quality,build quality is not very good,build_quality,14
fon,best fon ever i used,phone_type,71
phone,overpower nice phone,overall,65
honor mobile phone,very good nice superb honor mobile phone,phone_type,71
best value for money,i want to buy a 7000 rupee best value for money,value_for_money,104
product,product is wrost mobile has signal problem,overall,65
signal problem,product is wrost mobile has signal problem,signal_strength,86
this product,this product is very good,overall,65
battery,battery drains faster,battery,6
ram management,👎ram management 👎was poor,ram,82
app got reloading,app got reloading,app_issues,2
product,good product 👍,overall,65
phone,"phone is nice, display of all honor phones are always crisp and bright",overall,65
display,"phone is nice, display of all honor phones are always crisp and bright",display,37
battery life,"battery life is average, camera is good, performance is good",battery_life,7
camera,"battery life is average, camera is good, performance is good",camera,17
performance,"battery life is average, camera is good, performance is good",performance,68
value for money,tooo bad not value for money,value_for_money,104
phone,phone is not get started problem in a 1 year so please don't buy this phone bad phone 📱📱😔😔,overall,65
mobile,very smart mobile with all features and also flipkart delivery boy good behave,features,44
features,very smart mobile with all features and also flipkart delivery boy good behave,features,44
price,that price awesome mobile,price,74
mobile,that price awesome mobile,overall,65
looking very nice,looking very nice 👍,design,34
phone,very good phone this price range,overall,65
product,please don't buy this product,overall,65
performance of the phone,performance of the phone is so bad,performance,68
phone,this is totally scam & this is a chinese phone so as a indian we should avoid this phone,phone_type,71
product,please don't by this worthless productbecause this a trash 💩💩💩💩💩💩💩,overall,65
fit for pubg mobile,fit for pubg mobile,gaming_performance,47
budget phone,best budget phone 😍😍😍,budget_category,12
product,very nice product,overall,65
camera,best camera phone under 10000,camera,17
average,not good average,overall,65
slim,so beutiful slim nice i love you inar ashu🎂🎂🎂🎂🎂🎂🎂🎂🎂🎂🎂🎂🎂🎂🎂🎂🎂🎂🎂🎂🎂🎂🎂🎂🎂🎂 ❤️❤️❤️❤️❤️❤️❤️❤️❤️❤️❤️❤️❤️❤️❤️❤️❤️❤️❤️❤️❤️❤️❤️❤️❤️❤️❤️❤️❤️❤️❤️❤️❤️❤️❤️❤️❤️❤️❤️❤️❤️❤️❤️❤️❤️❤️❤️❤️❤️❤️,slimness,88
phone,the excellent phone at this budget,overall,65
functioning,5 years now and its functioning too good,performance,68
camera,camera is not perfect as i aspect,camera,17
all,that all are good,overall,65
money,worth for money,value_for_money,104
phone,this phone is awesome,overall,65
any department,i used this phone for continously 1 year and there was no problem in any department,overall,65
phone,good phone but chinese,phone_type,71
