raw_aspect,sentence,label,label_id
chinese,good phone but chinese,brand,10
phone performance,phone performance is good,performance,68
hang issue,no hang issue,performance_issues,69
battery backup,battery backup is also very good,battery_life,7
camera,camera is working fine,camera,17
phone display,phone displayis superb,display,37
product,such nice product and it's really value for money,value_for_money,104
value for money,such nice product and it's really value for money,value_for_money,104
product,and its standard product,product_category,75
mobile,good mobile for the price paid,phone_type,71
price,good mobile for the price paid,price,74
mobiles in the price range,one of the good mobiles in the price range,overall_value,66
lag,doesn't lag much for normal use,performance,68
budget constrained,can buy if you are budget constrained,budget_category,12
phone display,my phone display was cracked only taken for few months,display,37
product,it's a good product,overall,65
osm camera,best mobile osm camera and battery backup is wonderfull value money to best prosscesar in mobile,camera,17
battery backup,best mobile osm camera and battery backup is wonderfull value money to best prosscesar in mobile,battery,6
value money,best mobile osm camera and battery backup is wonderfull value money to best prosscesar in mobile,value_for_money,104
best prosscesar,best mobile osm camera and battery backup is wonderfull value money to best prosscesar in mobile,performance,68
perfomence,good perfomencelow heateclear neteverything ok,performance,68
heate,good perfomencelow heateclear neteverything ok,heat,52
net,good perfomencelow heateclear neteverything ok,network,61
everything ok,good perfomencelow heateclear neteverything ok,overall,65
overall,"overall nice product, got it for 7200 about 1 yr ago , nice in this price , but now it is too costly",overall,65
price,"overall nice product, got it for 7200 about 1 yr ago , nice in this price , but now it is too costly",price,74
mobile,owesome mobile at this price,phone_type,71
price,owesome mobile at this price,price,74
it,i love it 😘😘😘😘😘,overall,65
performance,"excellent performance after using 8 months, i got honor 10 lite for rs 7199/",performance,68
honor 10 lite,"excellent performance after using 8 months, i got honor 10 lite for rs 7199/",product_name,77
display,display very good at this price segment,display,37
primary camera,primary camera quite good,camera,17
selfie camera,selfie camera awesome,camera,17
bettery performance,bettery performance ok,battery,6
phone,"vary nice phone ,processer vary fast",overall,65
processer,"vary nice phone ,processer vary fast",performance,68
phone,"phone is superb under 10k front camera is good while rear camera is not so gud, all other things are also fine",overall,65
front camera,"phone is superb under 10k front camera is good while rear camera is not so gud, all other things are also fine",camera,17
rear camera,"phone is superb under 10k front camera is good while rear camera is not so gud, all other things are also fine",camera,17
all other things,"phone is superb under 10k front camera is good while rear camera is not so gud, all other things are also fine",general_features,49
smart phone,good and budget smart phone,phone_type,71
phone,nice phone from honor,phone_type,71
this,completely satisfy with this,overall,65
phone,i bought it for my fatherits really good phone in this pricebattery backup is not satisfied,overall,65
battery backup,i bought it for my fatherits really good phone in this pricebattery backup is not satisfied,battery_life,7
value for money product,"value for money product, slim, latest software updatation , lockdown extended warranty, user friendly , realy good product",value_for_money,104
slim,"value for money product, slim, latest software updatation , lockdown extended warranty, user friendly , realy good product",slimness,88
latest software updatation,"value for money product, slim, latest software updatation , lockdown extended warranty, user friendly , realy good product",software,91
user friendly,"value for money product, slim, latest software updatation , lockdown extended warranty, user friendly , realy good product",usability,103
realy good product,"value for money product, slim, latest software updatation , lockdown extended warranty, user friendly , realy good product",quality,81
honor ph,honor ph is the best,product_name,77
camera,camera is not gud over colour boosted worst and no screen lock imgage limited manualy loading image some other mobile automicaly online updated and camera not gud,camera,17
colour boosted,camera is not gud over colour boosted worst and no screen lock imgage limited manualy loading image some other mobile automicaly online updated and camera not gud,color_reproduction,26
screen lock imgage,camera is not gud over colour boosted worst and no screen lock imgage limited manualy loading image some other mobile automicaly online updated and camera not gud,display,37
image,camera is not gud over colour boosted worst and no screen lock imgage limited manualy loading image some other mobile automicaly online updated and camera not gud,camera,17
display,display and touch sensor is very poor quality,display,37
touch sensor,display and touch sensor is very poor quality,touchscreen,101
price,best price for the product,price,74
camera quality,"camera quality is awesome and battery is very high, performances is super",camera,17
battery,"camera quality is awesome and battery is very high, performances is super",battery,6
performances,"camera quality is awesome and battery is very high, performances is super",performance,68
value of money,value of money,value_for_money,104
camera quality,best camera quality,camera,17
smartphone,best smartphone this range,phone_type,71
phone,"the best phone i ever used, pubg playing smoothly, no heating even after playing for 2,3 hours",overall,65
pubg playing,"the best phone i ever used, pubg playing smoothly, no heating even after playing for 2,3 hours",gaming_performance,47
heating,"the best phone i ever used, pubg playing smoothly, no heating even after playing for 2,3 hours",heat,52
64gb storage,"go for 64gb storage because i bought 32gb phone ,half of the memory will take for os",storage,98
32gb phone,"go for 64gb storage because i bought 32gb phone ,half of the memory will take for os",storage,98
memory,"go for 64gb storage because i bought 32gb phone ,half of the memory will take for os",storage,98
os,"go for 64gb storage because i bought 32gb phone ,half of the memory will take for os",storage,98
camera quality,"after the android 10 update camera quality has reduced slightly, but doesnt matter i hope it will be okay in next update",camera_quality,20
product,very good product for normal use,overall,65
mobile phone,such a best mobile phone in this cost,phone_type,71
cost,such a best mobile phone in this cost,value_for_money,104
battery,battery is very hastely draining guys,battery,6
back panel,and the back panel catches dirt very much😣😑,build_quality,14
ph,best ph for parents,phone_type,71
phone,excellent phone in 8000 budgetthankyou flipkart,overall,65
budget,excellent phone in 8000 budgetthankyou flipkart,budget_category,12
phone,affordable phone at affordable rate you can go for it,price,74
affordable rate,affordable phone at affordable rate you can go for it,value_for_money,104
budget product,nice budget product,budget_category,12
cemra,nice cemra the same sunil kumar,camera,17
phone,phone has slowed down a lot,performance,68
mobile phone,very good mobile phone,phone_type,71
performance,not good performance as lower type phone,performance,68
mid range device,best mid range device,device_segment,36
money value,nice this phone by this money value,value_for_money,104
qualityfor camera,best qualityfor camera,camera_quality,20
phone,best phone on this price,overall,65
price,best phone on this price,price,74
working,it is working very well,performance,68
product,it's an amazing product,overall,65
build quality,this mobile is awesome build quality and battery very bad,build_quality,14
battery,this mobile is awesome build quality and battery very bad,battery,6
looking,good looking and camera,design,34
camera,good looking and camera,camera,17
good,good but heating,overall,65
heating,good but heating,heat,52
phone,one of the best phone i ever seen,overall,65
phone,phone is not working after use of 1 month,overall,65
money,better use of money,value_for_money,104
battery,battery is low,battery,6
mobile,good mobile in low budget,overall,65
low budget,good mobile in low budget,price,74
honar phone,best honar phone,overall,65
battery,after using this phone for 8 months best battery best camera qualitynice graphics no heating problem no hanging problem,battery,6
camera quality,after using this phone for 8 months best battery best camera qualitynice graphics no heating problem no hanging problem,camera_quality,20
graphics,after using this phone for 8 months best battery best camera qualitynice graphics no heating problem no hanging problem,graphics,50
heating problem,after using this phone for 8 months best battery best camera qualitynice graphics no heating problem no hanging problem,heat,52
hanging problem,after using this phone for 8 months best battery best camera qualitynice graphics no heating problem no hanging problem,performance_issues,69
camera quality,good camera quality,camera_quality,20
pubg game in full hd graphic,nyce phonepubg game in full hd graphic no lake,gaming_performance,47
lake,nyce phonepubg game in full hd graphic no lake,gaming_performance,47
device,sophestically budget friendly device,value_for_money,104
smartphone,this is a best and budget friendly smartphone in market i was searched many phones online and on you tube but i was found this one is best here is only one disadvantage that is a battry,phone_type,71
budget friendly,this is a best and budget friendly smartphone in market i was searched many phones online and on you tube but i was found this one is best here is only one disadvantage that is a battry,value_for_money,104
battry,this is a best and budget friendly smartphone in market i was searched many phones online and on you tube but i was found this one is best here is only one disadvantage that is a battry,battery,6
camera,"budged mobile camera,sound,battery wrking good",camera,17
sound,"budged mobile camera,sound,battery wrking good",sound_quality,93
battery,"budged mobile camera,sound,battery wrking good",battery,6
mibile,mind blowing mibile,phone,70
mobile,nice mobile in their budget segment,phone_type,71
budget segment,nice mobile in their budget segment,budget_category,12
product,"as expected awesome product, because m previously using honor mobile,n would expect same for💪👌👍",overall,65
satisfied,i'm very very satisfied,overall,65
mobile,"good mobile for low price,👌",phone_type,71
low price,"good mobile for low price,👌",price,74
working,it was great and working well till datethanks for the same swapan kumar saha,performance,68
signal,some signal problems,signal_strength,86
phone,best phone in low price,phone_type,71
price,best phone in low price,price,74
price,in this price this is very gorgeous phone battery backup is very nice looking cool the phone is lightweight,price,74
battery backup,in this price this is very gorgeous phone battery backup is very nice looking cool the phone is lightweight,battery_life,7
looking cool,in this price this is very gorgeous phone battery backup is very nice looking cool the phone is lightweight,design,34
phone is lightweight,in this price this is very gorgeous phone battery backup is very nice looking cool the phone is lightweight,weight,108
all,all is okay,overall,65
condition after 3 month while putting the mobile in pocket,condition after 3 month while putting the mobile in pocket,build_quality,14
value for money,value for money in this range,value_for_money,104
value for money,good value for money,value_for_money,104
phone,it's a good phone,overall,65
budget device,its a nice budget device for normal day to day use,budget_category,12
normal day to day use,its a nice budget device for normal day to day use,daily_use,33
phone,good phone based for mony,phone,70
mony,good phone based for mony,value_for_money,104
product,so nice product,overall,65
mobile,mobile is very very very nice but seller pack is very very very bad no safety,phone,70
price range,osum in this price range under 8000,price,74
product item,very good product item,overall,65
battery low,battery low hai best product,battery,6
best product,battery low hai best product,overall,65
it,it's better than vivo and realme phones p,overall,65
display,"display is not good , sound pitch is not good , i suggest everyone before purchasing pls visit nearest shop",display,37
sound pitch,"display is not good , sound pitch is not good , i suggest everyone before purchasing pls visit nearest shop",sound_quality,93
one of the best,one of the best,overall,65
display,display phone under the price of 8k,display,37
smooth performance,"it has smooth performance, and a decent battery for a normal and basic daily usage",performance,68
decent battery,"it has smooth performance, and a decent battery for a normal and basic daily usage",battery,6
selfie camera,best selfie camera ur 8 k,camera,17
phone,very very wonderful phone,overall,65
all feature,all feature best another company phone,general_features,49
mobile phone,in this price range this mobile phone is better in the market than all other but buy on sale time,phone_type,71
price range,in this price range this mobile phone is better in the market than all other but buy on sale time,price,74
value for money,value for money nd nic look performance is also good👌,value_for_money,104
nic look,value for money nd nic look performance is also good👌,design,34
performance,value for money nd nic look performance is also good👌,performance,68
camera,super camera phon this price i like it,camera,17
price,super camera phon this price i like it,price,74
it,it was worth it,overall,65
nonnor 10 lite,nonnor 10 lite almost good but battery back up not good,product_name,77
battery back up,nonnor 10 lite almost good but battery back up not good,battery_life,7
product,nice product so good,overall,65
cons,that's the only cons otherwise it's okay,negative_aspects,60
it's okay,that's the only cons otherwise it's okay,overall,65
over all,over all good,overall,65
mobile,very good mobile nice camera honour 10 lite,phone_type,71
camera,very good mobile nice camera honour 10 lite,camera,17
fhd display,for fhd display,display,37
battery,and a 3400 mah not much but good enough battery,battery,6
phone,best phone honor 10 lite and best price,phone,70
price,best phone honor 10 lite and best price,price,74
cell phone,amazing cell phone,phone,70
display,display broken withinfew weeks,display,37
phone fully dead,phone fully dead within 6months,battery_life,7
mobil value of money,is good mobil value of money,value_for_money,104
phone,"good phone with decent camera, processor is also good",phone,70
camera,"good phone with decent camera, processor is also good",camera,17
processor,"good phone with decent camera, processor is also good",performance,68
honer,excellent honer keep it up,brand,10
camera,camera is having dull quality,camera_quality,20
honor phones,good honor phones flipkart,phone,70
phone,very beautiful phone and working is very good,phone,70
working,very beautiful phone and working is very good,performance,68
camera,very good camera and all fuchars,camera,17
fuchars,very good camera and all fuchars,features,44
product,very good quality product must buy,overall,65
money,superb for this money,value_for_money,104
product,good product awesome,overall,65
mobile,nice mobile good bettry backup osam mobile,phone,70
bettry backup,nice mobile good bettry backup osam mobile,battery_life,7
quality,quality is very good for the price,quality,81
price,quality is very good for the price,price,74
wow,just wow 👌👌👌,overall,65
phone,best phone in this range,phone,70
camera,also again good camera,camera,17
selfie,special for selfie,selfie_camera,85
8000,got it for 8000,price,74
price point,awesome at that price point,price,74
mobile phone,excellent shipping and good quality mobile phone in fkart,phone,70
buy it,buy it without any doubt,overall,65
camera,"camera, battery, display all r superb👌👌👌",camera,17
battery,"camera, battery, display all r superb👌👌👌",battery,6
display,"camera, battery, display all r superb👌👌👌",display,37
product from price,it is a very good product from price,value_for_money,104
camera,superb camera🤟🤟 up up,camera,17
outlook,outlook is awesome apart from that rest is reasonably good,outlook,64
rest,outlook is awesome apart from that rest is reasonably good,overall,65
hanging,my phone is hanging,performance_issues,69
performance,"i like it very well, good performance",performance,68
phone,"amazing phone, love it",overall,65
smartphone,nyc smartphone in this range,phone_type,71
phone,very good phone and very good quality,overall,65
quality,very good phone and very good quality,quality,81
camera,camera is very good,camera,17
picture,very nice picture osm camera best tha 2019 mobile 😘😘😘,camera,17
camera,very nice picture osm camera best tha 2019 mobile 😘😘😘,camera,17
mobile,very nice picture osm camera best tha 2019 mobile 😘😘😘,phone,70
phone,phone is good but we can't able to run 2 apps at a time,phone,70
run 2 apps at a time,phone is good but we can't able to run 2 apps at a time,performance,68
phone,best phone best value,phone,70
value,best phone best value,value_for_money,104
selfie and photo camera,honor 10 lite is perfect selfie and photo camera phone,camera,17
📷 camera,fantastic 📷 camera and looks display is realy,camera,17
looks display,fantastic 📷 camera and looks display is realy,display,37
phone,good phone for the price,phone,70
battery performance,battery performance is not good,battery_life,7
mobile,very nice mobile,phone,70
comfort,"comfort, slim and good, but battery backup should be increase",design,34
slim,"comfort, slim and good, but battery backup should be increase",slimness,88
battery backup,"comfort, slim and good, but battery backup should be increase",battery_life,7
honor 10 lite,honor 10 lite best,product_name,77
phon,lovely phon in small price,phone,70
small price,lovely phon in small price,price,74
battery backup,but battery backup not good,battery_life,7
8000 rs,best in 8000 rs,price,74
all over good according to value,"all over good according to value not best, habg issue when play high graphic games",value_for_money,104
habg issue when play high graphic games,"all over good according to value not best, habg issue when play high graphic games",gaming_performance,47
battery,battery needs improvement,battery,6
smartphone,awesome smartphone in budget,phone_type,71
budget,awesome smartphone in budget,budget_category,12
usage,good for average usage,usability,103
mobile,mobile is good u can purchase it,phone,70
performance,and performance is also well,performance,68
phone,good phone in this price,phone,70
price,good phone in this price,price,74
product,product is very good,overall,65
deal in price,better deal in price but battery mah less,price,74
battery mah,better deal in price but battery mah less,battery,6
phoneworth every penny,very nice phoneworth every penny,value_for_money,104
phone,phone is working,phone,70
good looking slim mobile,"nice one, good looking slim mobile",design,34
overall,all overall good,overall,65
phone,phone is good but delivery very bad,phone,70
value for money,value for money nice camera battery charging fastbattery backup awesome i play ping mobile 2 times and i see temperature and maintain around 30° and battery consumption around 10 to 15%nice perfomance great deal thank you flipkart,value_for_money,104
camera,value for money nice camera battery charging fastbattery backup awesome i play ping mobile 2 times and i see temperature and maintain around 30° and battery consumption around 10 to 15%nice perfomance great deal thank you flipkart,camera,17
battery,value for money nice camera battery charging fastbattery backup awesome i play ping mobile 2 times and i see temperature and maintain around 30° and battery consumption around 10 to 15%nice perfomance great deal thank you flipkart,battery,6
charging fast,value for money nice camera battery charging fastbattery backup awesome i play ping mobile 2 times and i see temperature and maintain around 30° and battery consumption around 10 to 15%nice perfomance great deal thank you flipkart,charging_speed,24
battery backup,value for money nice camera battery charging fastbattery backup awesome i play ping mobile 2 times and i see temperature and maintain around 30° and battery consumption around 10 to 15%nice perfomance great deal thank you flipkart,battery_life,7
temperature,value for money nice camera battery charging fastbattery backup awesome i play ping mobile 2 times and i see temperature and maintain around 30° and battery consumption around 10 to 15%nice perfomance great deal thank you flipkart,heat,52
battery consumption,value for money nice camera battery charging fastbattery backup awesome i play ping mobile 2 times and i see temperature and maintain around 30° and battery consumption around 10 to 15%nice perfomance great deal thank you flipkart,battery,6
perfomance,value for money nice camera battery charging fastbattery backup awesome i play ping mobile 2 times and i see temperature and maintain around 30° and battery consumption around 10 to 15%nice perfomance great deal thank you flipkart,performance,68
phone,great phone in this range,phone,70
phone,phone is good,phone,70
external body,"but, external body is made of cheap plastic",build_quality,14
ph,awsm ph good quality,phone,70
quality,awsm ph good quality,quality,81
phone,phone is very good in budget,phone,70
budget,phone is very good in budget,budget_category,12
screen damage,screen damage will easily,display,37
mobail phone,super mobail phone,phone,70
phone,osm phone in this price range killer mobiles i can play pubg its play pubg hd graphics,phone,70
price range,osm phone in this price range killer mobiles i can play pubg its play pubg hd graphics,price,74
pubg its play pubg hd graphics,osm phone in this price range killer mobiles i can play pubg its play pubg hd graphics,gaming_performance,47
3 gb ram,just 3 gb ram,ram,82
selfi,selfi is awesome value of money,selfie_camera,85
value of money,selfi is awesome value of money,value_for_money,104
mobile,only mobile best under 8000 rs,phone,70
good one in middle range,good one in middle range,value_for_money,104
performance,excellent performanceawesome mobile in low budget,performance,68
mobile,excellent performanceawesome mobile in low budget,phone,70
low budget,excellent performanceawesome mobile in low budget,budget_category,12
mobile,its very best mobile i purchage 6 mobile honor 10 lite,phone_type,71
honor 10 lite,its very best mobile i purchage 6 mobile honor 10 lite,product_name,77
product,nice product at 8k prize,price,74
prize,nice product at 8k prize,price,74
performance,"best device in even 2019 ending coz of its performance,display,cameras,and the finish of the device",performance,68
display,"best device in even 2019 ending coz of its performance,display,cameras,and the finish of the device",display,37
cameras,"best device in even 2019 ending coz of its performance,display,cameras,and the finish of the device",camera,17
finish of the device,"best device in even 2019 ending coz of its performance,display,cameras,and the finish of the device",appearance,5
phone,perfect phone in low price,phone,70
price,perfect phone in low price,price,74
product,great product with good quality,overall,65
quality,great product with good quality,quality,81
product,its good product spacially for music i am buying because other companyes mobile not good music provide,overall,65
music,its good product spacially for music i am buying because other companyes mobile not good music provide,sound_quality,93
other companyes mobile not good music provide,its good product spacially for music i am buying because other companyes mobile not good music provide,competitor_comparison_music,29
mobile,verry good mobile,phone,70
look,nice look product and good quality product,design,34
quality,nice look product and good quality product,quality,81
mobile,amazing mobile and very estable one,phone,70
estable one,amazing mobile and very estable one,stability,97
phones,superb phones everything is good,phone,70
everything,superb phones everything is good,overall,65
good but not better,good but not better,overall,65
hardware,honor 10 lite mobile phone awesome becouse m parched third time but this time hardware n software problems becouse screen display blink n suddenly switch on off so i replaced i hope next product greatest quality provides,internal_components,53
software,honor 10 lite mobile phone awesome becouse m parched third time but this time hardware n software problems becouse screen display blink n suddenly switch on off so i replaced i hope next product greatest quality provides,software,91
screen display,honor 10 lite mobile phone awesome becouse m parched third time but this time hardware n software problems becouse screen display blink n suddenly switch on off so i replaced i hope next product greatest quality provides,display,37
camera,good camera but battery bad,camera,17
battery,good camera but battery bad,battery,6
volume button,volume button not working,button,15
camera,camera is a good,camera,17
nice product,it's nice product but my phone required resolution fhd+ video not support😟😟😟,product_quality,78
resolution fhd+ video not support,it's nice product but my phone required resolution fhd+ video not support😟😟😟,video_resolution,106
mobile,mobile is very good,phone,70
